{"$schema":"https://json-schema.org/draft/2020-12/schema","$id":"https://catalog.local/schemas/v1/audit-finding.schema.json","title":"audit-finding","type":"object","additionalProperties":false,"required":["schema_version","finding_id","audit_rule_id","audit_rule_version","scope","product_identity","subject","severity","blocking","message_code","parameters","evidence_references","upstream_fingerprints","approval_reference","resolution_state","policy_fingerprint"],"properties":{"schema_version":{"const":"1.0.0"},"finding_id":{"type":"string","pattern":"^finding-[0-9a-f]{24}$"},"audit_rule_id":{"type":"string"},"audit_rule_version":{"type":"string"},"scope":{"enum":["catalog","product"]},"product_identity":{"type":["string","null"]},"subject":{"type":["string","null"]},"severity":{"enum":["error","blocking_review","warning","info"]},"blocking":{"type":"boolean"},"message_code":{"type":"string"},"parameters":{"type":"object"},"evidence_references":{"type":"array","items":{"type":"string"}},"upstream_fingerprints":{"type":"array","items":{"$ref":"common-definitions.schema.json#/$defs/sha256"}},"approval_reference":{"type":["string","null"]},"resolution_state":{"enum":["open","resolved_by_exact_approval","not_applicable","superseded_by_input_change"]},"policy_fingerprint":{"$ref":"common-definitions.schema.json#/$defs/sha256"}}}
