{"schema_version":"1.0.0","finding_id":"finding-aaaaaaaaaaaaaaaaaaaaaaaa","audit_rule_id":"fixture.rule","audit_rule_version":"1","scope":"product","product_identity":"fixture-product","subject":"category","severity":"warning","blocking":false,"message_code":"FIXTURE_WARNING","parameters":{},"evidence_references":["fixture-evidence"],"upstream_fingerprints":["aaaaaaaaaaaaaaaaaaaaaaaaaaaaaaaaaaaaaaaaaaaaaaaaaaaaaaaaaaaaaaaa"],"approval_reference":null,"resolution_state":"open","policy_fingerprint":"bbbbbbbbbbbbbbbbbbbbbbbbbbbbbbbbbbbbbbbbbbbbbbbbbbbbbbbbbbbbbbbb"}
